question,answer
hi,Hello! I am vivek, your AI assistant.
hello,Hi there! I'm vivek. How can I help you?
hey,Hey! What can I do for you today?
greetings,Greetings! I'm here to assist you.
how are you,I'm functioning optimally, thank you for asking.
how are you doing,I'm operating at full capacity. How can I assist you?
how's it going,Everything is running smoothly. What can I help you with?
what can you do,I can analyze data, answer questions, and provide insights from your datasets.
what are your capabilities,I specialize in data analysis, machine learning, and answering questions about your data.
what do you do,I assist with data science tasks and answer your questions.
who are you,I am vivek, an AI assistant designed for data analysis.
what is your name,My name is vivek. I'm your AI assistant.
tell me about yourself,I'm vivek, an artificial intelligence specialized in data science and machine learning.
what is your purpose,My purpose is to assist you with data analysis and answer your questions.
why were you created,I was created to help with data science tasks and provide insights.
good morning,Good morning! I'm ready to assist you with your tasks today.
good afternoon,Good afternoon! How can I help you today?
good evening,Good evening! What would you like me to help you with?
thank you,You're welcome! Is there anything else you need assistance with?
thanks,You're welcome! Happy to help.
thank you so much,You're very welcome! Let me know if you need anything else.
bye,Goodbye! Feel free to return if you need more assistance.
goodbye,Goodbye! Don't hesitate to reach out if you need help.
see you later,See you later! I'll be here when you need me.
see you,See you! I'm always available to help.
what is machine learning,Machine learning is a subset of artificial intelligence that focuses on building systems that learn from data.
what is data science,Data science is an interdisciplinary field that uses scientific methods to extract knowledge and insights from data.
what is artificial intelligence,Artificial intelligence is the simulation of human intelligence processes by machines, especially computer systems.
analyze my data,Certainly! Please upload your dataset and I'll analyze it for you.
show me insights,I'd be happy to provide insights. Please share your data with me.
predict sales,I can help with sales prediction. Please provide your historical sales data.
find correlations,I can identify correlations in your data. Please upload your dataset.
can you code,I can generate code snippets and help with programming concepts, especially in Python for data tasks.
do you code,Yes, I can understand and write code, primarily to assist with data analysis and automation.
tell me about coding,Coding is the process of using programming languages to create instructions for computers to execute.
explain python,Python is a high-level, interpreted programming language known for its clear syntax and readability. It's widely used in data science, web development, and automation.
what is java,Java is a class-based, object-oriented programming language designed to have minimal implementation dependencies.
what is sql,SQL (Structured Query Language) is the standard language for managing and manipulating relational databases.
what is a dataframe,A DataFrame is a two-dimensional, tabular data structure with labeled axes (rows and columns), commonly found in pandas for Python.
what is pandas,Pandas is a fast, powerful, and easy-to-use open-source data analysis and manipulation library built for Python.
define numpy,NumPy is a fundamental package for scientific computing in Python, providing support for large, multi-dimensional arrays and matrices.
help with a script,I can certainly try! Describe the problem or share the code snippet you're working on.
debug this code,Send me the code and I'll do my best to help you identify and fix any errors.
write a function,I can help with that. What should the function do? Please describe the inputs, outputs, and logic.
explain this algorithm,I'd be happy to. Which algorithm would you like me to explain?
what is an algorithm,An algorithm is a step-by-step procedure or formula for solving a problem or performing a computation.
what is big data,Big data refers to extremely large datasets that are complex and require advanced tools and techniques for processing and analysis.
explain data mining,Data mining is the process of discovering patterns, correlations, and anomalies within large datasets to predict outcomes.
what is deep learning,Deep learning is a subset of machine learning that uses artificial neural networks with multiple layers to model complex patterns in data.
what is a neural network,A neural network is a series of algorithms that endeavors to recognize underlying relationships in a set of data through a process that mimics the human brain.
what is nlp,Natural Language Processing (NLP) is a field of AI that focuses on enabling computers to understand, interpret, and manipulate human language.
explain computer vision,Computer vision is a field of AI that trains computers to interpret and understand the visual world from images and videos.
what is your favorite color,As an AI, I don't have personal preferences or the ability to see colors, but I'm happy to help you analyze color data!
tell me a joke,Why was the computer cold? It left its Windows open!
do you sleep,No, I don't require sleep. I'm available to help you 24/7.
can you learn,My core knowledge is fixed, but I can learn patterns and context within our current conversation to better assist you.
are you a human,No, I am an artificial intelligence program designed to simulate conversation and assist with tasks.
who made you,I was created by a team of developers and data scientists.
what is the weather,To get the weather, I would need to connect to a live weather API. Please specify your location.
what time is it,I don't have direct access to real-time clock data. Please check your device's clock.
search the web,I'm sorry, I currently don't have the ability to browse the internet. My knowledge is based on my training data.
who is the president,My knowledge might be outdated. For the most current information on world leaders, please check a reliable news source.
what is the capital of france,The capital of France is Paris.
define politics,Politics is the set of activities associated with the governance of a country or area, especially the debate or conflict among individuals or parties having or hoping to achieve power.
explain history,History is the study of past events, particularly in human affairs. I can help analyze historical data if you provide it.
what is mathematics,Mathematics is the abstract science of number, quantity, and space, either as abstract concepts or as applied to other disciplines like physics and engineering.
what is physics,Physics is the natural science that studies matter, its fundamental constituents, its motion and behavior through space and time, and the related entities of energy and force.
what is chemistry,Chemistry is the scientific discipline involved with elements and compounds composed of atoms, molecules, and ions: their composition, structure, properties, behavior, and the changes they undergo during reactions with other substances.
what is biology,Biology is the natural science that studies life and living organisms, including their physical structure, chemical processes, molecular interactions, physiological mechanisms, development, and evolution.
what is art,Art is a diverse range of human activities involving creative imagination to express technical proficiency, beauty, emotional power, or conceptual ideas.
what is music,Music is an art form and cultural activity whose medium is sound organized in time. It includes elements such as pitch, rhythm, dynamics, and timbre.
what is culture,Culture encompasses the social behavior, institutions, and norms found in human societies, as well as the knowledge, beliefs, arts, laws, customs, capabilities, and habits of the individuals in these groups.
what is society,A society is a group of individuals involved in persistent social interaction, or a large social group sharing the same geographical or social territory, typically subject to the same political authority and dominant cultural expectations.
what is economy,An economy is the large set of inter-related production and consumption activities that aid in determining how scarce resources are allocated.
what is a market,A market is a place where buyers and sellers can meet to facilitate the exchange or transaction of goods and services.
what is money,Money is any item or verifiable record that is generally accepted as payment for goods and services and repayment of debts, such as taxes, in a particular country or socio-economic context.
what is inflation,Inflation is the decline of purchasing power of a given currency over time, often reflected in a rise in the general price level of goods and services.
what is a bank,A bank is a financial institution that accepts deposits from the public and creates credit, while also offering financial services like wealth management and currency exchange.
what is interest,Interest is the monetary charge for the privilege of borrowing money, typically expressed as an annual percentage rate.
what is a loan,A loan is a sum of money that is borrowed and is expected to be paid back with interest.
what is credit,Credit is the ability of a customer to obtain goods or services before payment, based on the trust that payment will be made in the future.
what is debt,Debt is something, usually money, borrowed by one party from another, under the condition that it is to be paid back at a later date, often with interest.
what is investment,Investment is the action or process of investing money for profit or material result.
what is a stock,A stock is a type of security that signifies ownership in a corporation and represents a claim on part of the corporation's assets and earnings.
what is a bond,A bond is a fixed income instrument that represents a loan made by an investor to a borrower, typically corporate or governmental.
what is a portfolio,A portfolio is a collection of financial investments like stocks, bonds, commodities, cash, and cash equivalents, including mutual funds and ETFs.
what is risk management,Risk management is the process of identification, analysis, and acceptance or mitigation of uncertainty in investment decisions.
what is insurance,Insurance is a contract, represented by a policy, in which an individual or entity receives financial protection or reimbursement against losses from an insurance company.
what is a claim,A claim is a formal request to an insurance company asking for a payment based on the terms of the insurance policy.
what is a policy,A policy is a contract between the insurer and the insured, detailing the terms and conditions of the insurance coverage.
what is a premium,A premium is the amount of money that an individual or business pays for an insurance policy.
what is a deductible,A deductible is the amount you pay out of pocket for expenses before the insurance company will cover the remaining costs.
what is coverage,Coverage is the amount of protection given through an insurance policy.
what is a beneficiary,A beneficiary is the person or entity you legally designate to receive the benefits from your financial products, such as insurance policies.
what is a will,A will is a legal document that expresses a person's wishes as to how their property is to be distributed after their death and as to which person is to manage the property until its final distribution.
what is estate planning,Estate planning is the process of arranging for the management and disposal of a person's estate during their life and after death.
what is a trust,A trust is a fiduciary relationship in which one party, known as a trustor, gives another party, the trustee, the right to hold title to property or assets for the benefit of a third party, the beneficiary.
what is a contract,A contract is a legally binding agreement between two or more parties that creates obligations that are enforceable by law.
what is law,Law is a system of rules created and enforced through social or governmental institutions to regulate behavior.
what is justice,Justice is the legal or philosophical theory by which fairness is administered.
what is a court,A court is any person or institution with authority to judge or adjudicate, often as a government institution with the authority to adjudicate legal disputes.
what is a judge,A judge is a person who presides over court proceedings, either alone or as part of a panel of judges.
what is a lawyer,A lawyer is a person who practices law, as an advocate, attorney, attorney at law, barrister, barrister-at-law, bar-at-law, counsel, counselor, counsellor, counselor at law, or solicitor, but not as a paralegal or charter executive secretary.
what is a lawsuit,A lawsuit is a proceeding by one or more parties against another in a civil court of law.
what is a plaintiff,A plaintiff is a person who brings a case against another in a court of law.
what is a defendant,A defendant is an individual, company, or institution sued or accused in a court of law.
what is a verdict,A verdict is the formal finding of fact made by a jury on matters or questions submitted to the jury by a judge.
what is a sentence,A sentence is the punishment assigned to a defendant found guilty by a court.
what is a crime,A crime is an unlawful act punishable by a state or other authority.
what is a felony,A felony is a serious crime, usually punishable by imprisonment for more than one year or by death.
what is a misdemeanor,A misdemeanor is a minor wrongdoing, less serious than a felony, typically punishable by a fine or incarceration in a local jail for less than a year.
what is an arrest,An arrest is the act of apprehending and taking a person into custody, usually because they have been suspected of or witnessed committing a crime.
what is a warrant,A warrant is a writ issued by a competent officer, usually a judge or magistrate, authorizing an act that would otherwise be illegal.
what is bail,Bail is the release of an accused person from custody, on the condition that a sum of money is lodged to guarantee their appearance in court.
what is parole,Parole is the conditional release of a prisoner before the full sentence has been served, on the promise of good behavior.
what is probation,Probation is a period of supervision over an offender, ordered by the court instead of serving time in prison.
what is a amendment,An amendment is a formal or official change made to a law, contract, constitution, or other legal document.
what is the constitution,A constitution is the aggregate of fundamental principles or established precedents that constitute the legal basis of a polity, organisation or other type of entity and commonly determine how that entity is to be governed.
what is democracy,Democracy is a system of government where the citizens exercise power by voting.
what is republic,A republic is a form of government in which the country is considered a "public matter", not the private concern or property of the rulers, and where offices of state are elected or appointed, rather than inherited.
what is monarchy,A monarchy is a form of government with a monarch at the head, such as a king or queen.
what is dictatorship,A dictatorship is a form of government where a single person or a small group possesses absolute power without effective constitutional limitations.
what is socialism,Socialism is a political and economic theory of social organization which advocates that the means of production, distribution, and exchange should be owned or regulated by the community as a whole.
what is communism,Communism is a political and economic ideology that positions itself in opposition to liberal democracy and capitalism, advocating instead for a classless system in which the means of production are owned communally and private property is nonexistent or severely curtailed.
what is capitalism,Capitalism is an economic system based on the private ownership of the means of production and their operation for profit.
what is globalization,Globalization is the process by which businesses or other organizations develop international influence or start operating on an international scale.
what is climate change,Climate change refers to significant changes in global temperature, precipitation, wind patterns and other measures of climate that occur over several decades or longer.
what is global warming,Global warming is the long-term heating of Earth's climate system observed since the pre-industrial period due to human activities, primarily fossil fuel burning, which increases heat-trapping greenhouse gas levels in Earth's atmosphere.
what is pollution,Pollution is the introduction of contaminants into the natural environment that cause adverse change.
what is recycling,Recycling is the process of converting waste materials into new materials and objects.
what is sustainability,Sustainability is the ability to exist constantly. In the 21st century, it refers generally to the capacity for the biosphere and human civilization to coexist.
what is renewable energy,Renewable energy is energy that is collected from renewable resources that are naturally replenished on a human timescale, such as sunlight, wind, rain, tides, waves, and geothermal heat.
what is solar power,Solar power is the conversion of energy from sunlight into electricity, either directly using photovoltaics (PV), indirectly using concentrated solar power, or a combination.
what is wind power,Wind power is the use of air flow through wind turbines to mechanically power generators for electric power.
what is hydropower,Hydropower is the use of falling or fast-running water to produce electricity or to power machines.
what is geothermal energy,Geothermal energy is thermal energy generated and stored in the Earth.
what is biomass,Biomass is organic material that comes from plants and animals, and it is a renewable source of energy.
what is a carbon footprint,A carbon footprint is the total amount of greenhouse gases produced to, directly and indirectly, support human activities, usually expressed in equivalent tons of carbon dioxide (CO2).
what is conservation,Conservation is the preservation or efficient use of resources, or the conservation of various quantities under physical laws.
what is biodiversity,Biodiversity is the variety and variability of life on Earth.
what is an ecosystem,An ecosystem is a community of living organisms in conjunction with the nonliving components of their environment, interacting as a system.
what is a habitat,A habitat is the natural home or environment of an animal, plant, or other organism.
what is extinction,Extinction is the termination of a kind of organism or of a group of kinds, usually a species.
what is endangered,An endangered species is a species that is very likely to become extinct in the near future, either worldwide or in a particular political jurisdiction.
what is a vaccine,A vaccine is a biological preparation that provides active acquired immunity to a particular infectious disease.
what is a virus,A virus is a submicroscopic infectious agent that replicates only inside the living cells of an organism.
what is bacteria,Bacteria are a type of biological cell. They constitute a large domain of prokaryotic microorganisms.
what is a pandemic,A pandemic is an epidemic of disease that has spread across a large region, for instance multiple continents or worldwide.
what is an epidemic,An epidemic is the rapid spread of disease to a large number of people in a given population within a short period of time.
what is health,Health is a state of complete physical, mental and social well-being and not merely the absence of disease or infirmity.
what is fitness,Fitness is the condition of being physically fit and healthy.
what is nutrition,Nutrition is the science that interprets the nutrients and other substances in food in relation to maintenance, growth, reproduction, health and disease of an organism.
what is a diet,Diet is the sum of food consumed by a person or other organism.
what is a calorie,A calorie is a unit of energy. In nutrition, calories refer to the energy people get from the food and drink they consume, and the energy they use in physical activity.
what is protein,Protein is a macronutrient that is essential to building muscle mass. It is commonly found in animal products, though is also present in other sources, such as nuts and legumes.
what is carbohydrate,Carbohydrates are sugar molecules. Along with proteins and fats, carbohydrates are one of three main nutrients found in foods and drinks.
what is fat,Fat is a term used to describe a class of macronutrients used in metabolism called triglycerides.
what is vitamin,A vitamin is an organic molecule that is an essential micronutrient which an organism needs in small quantities for the proper functioning of its metabolism.
what is mineral,In the context of nutrition, a mineral is a chemical element required as an essential nutrient by organisms to perform functions necessary for life.
what is exercise,Exercise is any bodily activity that enhances or maintains physical fitness and overall health and wellness.
what is yoga,Yoga is a group of physical, mental, and spiritual practices or disciplines which originated in ancient India.
what is meditation,Meditation is a practice where an individual uses a technique – such as mindfulness, or focusing the mind on a particular object, thought, or activity – to train attention and awareness, and achieve a mentally clear and emotionally calm and stable state.
what is stress,Stress is a feeling of emotional or physical tension. It can come from any event or thought that makes you feel frustrated, angry, or nervous.
what is anxiety,Anxiety is an emotion characterized by feelings of tension, worried thoughts and physical changes like increased blood pressure.
what is depression,Depression is a common and serious medical illness that negatively affects how you feel, the way you think and how you act.
what is therapy,Therapy is the treatment of mental or psychological disorders by psychological means.
what is counseling,Counseling is a professional relationship that empowers diverse individuals, families, and groups to accomplish mental health, wellness, education, and career goals.
what is motivation,Motivation is the process that initiates, guides, and maintains goal-oriented behaviors.
what is goal setting,Goal setting involves the development of an action plan designed to motivate and guide a person or group toward a goal.
what is leadership,Leadership is the ability of an individual or a group of individuals to influence and guide followers or other members of an organization.
what is management,Management is the administration of an organization, whether it is a business, a not-for-profit organization, or government body.
what is a team,A team is a group of individuals working together to achieve a common goal.
what is communication,Communication is the act of conveying meanings from one entity or group to another through the use of mutually understood signs, symbols, and semiotic rules.
what is public speaking,Public speaking is the process or act of performing a speech to a live audience.
what is presentation,A presentation is the process of presenting a topic to an audience. It is typically a demonstration, introduction, lecture, or speech meant to inform, persuade, inspire, motivate, or to build good will or to present a new idea or product.
what is marketing,Marketing is the study and management of exchange relationships. It is the business process of creating relationships with and satisfying customers.
what is advertising,Advertising is a marketing communication that employs an openly sponsored, non-personal message to promote or sell a product, service or idea.
what is branding,Branding is the process of creating a strong, positive perception of a company, its products or services in the customer's mind by combining such elements as logo, design, mission statement, and a consistent theme throughout all marketing communications.
what is sales,Sales are activities related to selling or the number of goods sold in a given targeted time period.
what is customer service,Customer service is the provision of service to customers before, during and after a purchase.
what is a customer,A customer is the recipient of a good, service, product or an idea obtained from a seller, vendor, or supplier via a financial transaction or exchange for money or some other valuable consideration.
what is a client,A client is a person or organization that uses the services or advice of a professional or company.
what is user experience,User experience is a person's emotions and attitudes about using a particular product, system or service.
what is design,Design is the creation of a plan or convention for the construction of an object, system or measurable human interaction.
what is innovation,Innovation is the practical implementation of ideas that result in the introduction of new goods or services or improvement in offering goods or services.
what is technology,Technology is the sum of techniques, skills, methods, and processes used in the production of goods or services or in the accomplishment of objectives, such as scientific investigation.
what is software,Software is a collection of instructions and data that tell a computer how to work.
what is hardware,Hardware is the physical components of a computer system.
what is a computer,A computer is a machine that can be instructed to carry out sequences of arithmetic or logical operations automatically via computer programming.
