question,answer
what is dividend,A dividend is the distribution of some of a company's earnings to a class of its shareholders.
what is portfolio,A portfolio is a collection of financial investments like stocks, bonds, commodities, cash, and cash equivalents.
what is risk,Risk is the possibility of something bad happening.
what is return,Return is the gain or loss of an investment over a specified period.
what is asset,An asset is a resource with economic value that an individual, corporation, or country owns or controls.
what is liability,A liability is something a person or company owes, usually a sum of money.
what is equity,Equity is the value of an asset after liabilities have been deducted.
what is balance sheet,A balance sheet is a financial statement that reports a company's assets, liabilities and shareholders' equity.
what is income statement,An income statement is one of the financial statements of a company and shows the company's revenues and expenses.
what is cash flow,Cash flow is the net amount of cash and cash-equivalents being transferred into and out of a business.
what is financial statement,A financial statement is a formal record of the financial activities and position of a business, person, or other entity.
what is audit,An audit is an independent examination of financial information of any entity.
what is accountant,An accountant is a practitioner of accounting or accountancy.
what is finance,Finance is the study and discipline of money, currency and capital assets.
what is economics,Economics is the social science that studies how people interact with value; in particular, the production, distribution, and consumption of goods and services.
what is supply,Supply is a fundamental economic concept that describes the total amount of a specific good or service that is available to consumers.
what is demand,Demand is an economic principle referring to a consumer's desire to purchase goods and services.
what is price,Price is the quantity of payment or compensation given by one party to another in return for one unit of goods or services.
what is value,Value is the monetary, material, or assessed worth of an asset, good, or service.
what is cost,Cost is the value of money that has been used up to produce something.
what is worth,Worth is the value of something measured by its qualities or by the esteem in which it is held.
what is quality,Quality is the standard of something as measured against other things of a similar kind.
what is quantity,Quantity is the amount or number of a material or abstract thing.
what is measure,Measure is the quantification of attributes of an object or event.
what is unit,A unit of measurement is a definite magnitude of a quantity, defined and adopted by convention.
what is scale,Scale is the ratio of the distance on a map to the corresponding distance on the ground.
what is size,Size is the magnitude or dimensions of a thing.
what is weight,Weight is the force exerted on a body by gravity.
what is height,Height is the measure of vertical distance.
what is length,Length is a measure of distance.
what is width,Width is the measurement or extent of something from side to side.
what is depth,Depth is the distance from the top or surface to the bottom of something.
what is volume,Volume is the quantity of three-dimensional space enclosed by a closed surface.
what is area,Area is the quantity that expresses the extent of a two-dimensional figure or shape.
what is speed,Speed is the rate at which someone or something is able to move or operate.
what is velocity,Velocity is the speed of something in a given direction.
what is acceleration,Acceleration is the rate of change of velocity per unit of time.
what is momentum,Momentum is the quantity of motion of a moving body.
what is force,In physics, a force is any interaction that, when unopposed, will change the motion of an object.
what is energy,Energy is the quantitative property that must be transferred to an object to perform work on, or to heat, the object.
what is power,Power is the amount of energy transferred or converted per unit time.
what is work,In physics, work is the energy transferred to or from an object via the application of force along a displacement.
what is pressure,Pressure is the force applied perpendicular to the surface of an object per unit area.
what is temperature,Temperature is a physical quantity that expresses hot and cold.
what is heat,Heat is the transfer of kinetic energy from one medium or object to another.
what is cold,Cold is the presence of low temperature.
what is weather,Weather is the state of the atmosphere, describing for example the degree to which it is hot or cold, wet or dry, calm or stormy, clear or cloudy.
what is climate,Climate is the long-term pattern of weather in a particular area.       