question,answer
what is a smartphone,A smartphone is a portable device that combines mobile telephone and computing functions into one unit.
what is the internet,The Internet is the global system of interconnected computer networks that uses the Internet protocol suite to communicate between networks and devices.
what is a website,A website is a collection of related web pages, including multimedia content, typically identified with a common domain name, and published on at least one web server.
what is a web page,A web page is a hypertext document on the World Wide Web. Web pages are delivered by a web server to the user and displayed in a web browser.
what is a browser,A web browser is a software application for accessing information on the World Wide Web.
what is a server,A server is a computer or system that provides resources, data, services, or programs to other computers, known as clients, over a network.
what is a network,A network is a group of two or more computers that are linked together.
what is cybersecurity,Cybersecurity is the practice of protecting systems, networks, and programs from digital attacks.
what is hacking,Hacking is the unauthorized intrusion into a computer or a network.
what is a password,A password is a secret word or phrase that must be used to gain admission to something.
what is encryption,Encryption is the process of converting information or data into a code, especially to prevent unauthorized access.
what is privacy,Privacy is the ability of an individual or group to seclude themselves, or information about themselves, and thereby express themselves selectively.
what is a cookie,An HTTP cookie is a small piece of data stored on the user's computer by the web browser while browsing a website.
what is a algorithm,An algorithm is a process or set of rules to be followed in calculations or other problem-solving operations, especially by a computer.
what is a program,A program is a set of instructions that a computer follows to perform a task.
what is coding,Coding is the process of using a programming language to get a computer to behave how you want it to.
what is programming,Programming is the process of creating a set of instructions that tell a computer how to perform a task.
what is a developer,A developer is an individual that builds and create software and applications.
what is engineering,Engineering is the use of scientific principles to design and build machines, structures, and other items, including bridges, tunnels, roads, vehicles, and buildings.
what is architecture,Architecture is both the process and the product of planning, designing, and constructing buildings or any other structures.
what is art,Art is a diverse range of human activities involving creative imagination to express technical proficiency, beauty, emotional power, or conceptual ideas.
what is music,Music is an art form and cultural activity whose medium is sound organized in time.
what is a song,A song is a musical composition intended to be performed by the human voice.
what is a artist,An artist is a person engaged in an activity related to creating art, practicing the arts, or demonstrating an art.
what is a painting,Painting is the practice of applying paint, pigment, color or other medium to a solid surface.
what is a sculpture,Sculpture is the branch of the visual arts that operates in three dimensions.
what is literature,Literature is any collection of written work, but it is also used more narrowly for writings specifically considered to be an art form.
what is a book,A book is a medium for recording information in the form of writing or images, typically composed of many pages bound together and protected by a cover.
what is poetry,Poetry is a form of literature that uses aesthetic and rhythmic qualities of language to evoke meanings in addition to, or in place of, the prosaic ostensible meaning.
what is a novel,A novel is a relatively long work of narrative fiction, normally written in prose form, and which is typically published as a book.
what is a story,A story is a description of a series of events, either true or fictitious.
what is a film,A film, also called a movie, motion picture, moving picture, or photoplay, is a series of still images that, when shown on a screen, create the illusion of moving images.
what is cinema,Cinema is the art and technology of motion-picture photography.
what is a actor,An actor is a person who portrays a character in a performance.
what is a director,A film director is a person who directs the making of a film.
what is photography,Photography is the art, application, and practice of creating durable images by recording light, either electronically by means of an image sensor, or chemically by means of a light-sensitive material such as photographic film.
what is a camera,A camera is an optical instrument used to record images.
what is travel,Travel is the movement of people between distant geographical locations.
what is tourism,Tourism is travel for pleasure or business; also the theory and practice of touring, the business of attracting, accommodating, and entertaining tourists, and the business of operating tours.
what is a vacation,A vacation is a leave of absence from a regular job, or a specific trip or journey, usually for the purpose of recreation or tourism.
what is a hotel,A hotel is an establishment that provides paid lodging on a short-term basis.
what is a restaurant,A restaurant is a business that prepares and serves food and drinks to customers.
what is cuisine,Cuisine is a style of cooking characterized by distinctive ingredients, techniques and dishes, and usually associated with a specific culture or geographic region.
what is food,Food is any substance consumed to provide nutritional support for an organism.
what is a recipe,A recipe is a set of instructions that describes how to prepare or make something, especially a culinary dish.
what is cooking,Cooking is the art, science, and craft of using heat to prepare food for consumption.
what is baking,Baking is a method of preparing food that uses dry heat, typically in an oven.
what is a ingredient,An ingredient is a substance that forms part of a mixture.
what is flavor,Flavor is the sensory impression of a food or other substance, and is determined mainly by the chemical senses of taste and smell.
what is taste,Taste is the sensation produced when a substance in the mouth reacts chemically with taste receptor cells located on taste buds in the oral cavity.
what is smell,Smell is the sense that allows us to perceive scents.
what is sound,Sound is a vibration that propagates as an acoustic wave, through a transmission medium such as a gas, liquid or solid.
what is light,Light is electromagnetic radiation within a certain portion of the electromagnetic spectrum.
what is color,Color is the characteristic of visual perception described through color categories, with names such as red, orange, yellow, green, blue, or purple.
what is energy,Energy is the quantitative property that must be transferred to an object in order to perform work on, or to heat, the object.
what is matter,Matter is any substance that has mass and takes up space by having volume.
what is gravity,Gravity is a natural phenomenon by which all things with mass or energy are brought toward one another.
what is force,In physics, a force is any interaction that, when unopposed, will change the motion of an object.
what is motion,Motion is the phenomenon in which an object changes its position over time.
what is time,Time is the continued sequence of existence and events that occurs in an apparently irreversible succession from the past, through the present, into the future.
what is space,Space is the boundless three-dimensional extent in which objects and events have relative position and direction.
what is the universe,The universe is all of space and time and their contents, including planets, stars, galaxies, and all other forms of matter and energy.
what is a star,A star is an astronomical object consisting of a luminous spheroid of plasma held together by its own gravity.
what is a planet,A planet is an astronomical body orbiting a star or stellar remnant that is massive enough to be rounded by its own gravity.
what is earth,Earth is the third planet from the Sun and the only astronomical object known to harbor life.
what is the moon,The Moon is Earth's only natural satellite.
what is the sun,The Sun is the star at the center of the Solar System.
what is a galaxy,A galaxy is a gravitationally bound system of stars, stellar remnants, interstellar gas, dust, and dark matter.
what is a black hole,A black hole is a region of spacetime where gravity is so strong that nothing—no particles or even electromagnetic radiation such as light—can escape from it.
what is evolution,Evolution is change in the heritable characteristics of biological populations over successive generations.
what is natural selection,Natural selection is the differential survival and reproduction of individuals due to differences in phenotype.
what is genetics,Genetics is the study of genes, genetic variation, and heredity in living organisms.
what is dna,DNA is a molecule composed of two chains that coil around each other to form a double helix carrying genetic instructions.
what is a gene,A gene is a sequence of DNA or RNA that codes for a molecule that has a function.
what is a chromosome,A chromosome is a DNA molecule with part or all of the genetic material of an organism.
what is a cell,A cell is the basic structural, functional, and biological unit of all known organisms.
what is a organism,An organism is any individual entity that embodies the properties of life.
what is a plant,A plant is any organism in the kingdom Plantae.
what is a animal,An animal is a multicellular, eukaryotic organism in the biological kingdom Animalia.
what is a human,A human is a member of the species Homo sapiens.
what is consciousness,Consciousness is the state of being aware of and responsive to one's surroundings.
what is thought,Thought is an idea or opinion produced by thinking, or occurring suddenly in the mind.
what is memory,Memory is the faculty of the brain by which data or information is encoded, stored, and retrieved when needed.
what is learning,Learning is the process of acquiring new understanding, knowledge, behaviors, skills, values, attitudes, and preferences.
what is knowledge,Knowledge is a familiarity, awareness, or understanding of someone or something, such as facts, information, descriptions, or skills.
what is wisdom,Wisdom is the ability to think and act using knowledge, experience, understanding, common sense and insight.
what is truth,Truth is the property of being in accord with fact or reality.
what is reality,Reality is the sum or aggregate of all that is real or existent within a system, as opposed to that which is only imaginary.
what is perception,Perception is the organization, identification, and interpretation of sensory information in order to represent and understand the presented information, or the environment.
what is belief,A belief is an attitude that something is the case, or that some proposition about the world is true.
what is faith,Faith is confidence or trust in a person, thing, or concept.
what is religion,Religion is a social-cultural system of designated behaviors and practices, morals, worldviews, texts, sanctified places, prophecies, ethics, or organizations, that relates humanity to supernatural, transcendental, and spiritual elements.
what is philosophy,Philosophy is the study of general and fundamental questions about existence, knowledge, values, reason, mind, and language.
what is ethics,Ethics or moral philosophy is a branch of philosophy that involves systematizing, defending, and recommending concepts of right and wrong behavior.
what is morality,Morality is the differentiation of intentions, decisions and actions between those that are distinguished as proper and those that are improper.
what is justice,Justice is the principle that people receive that which they deserve.
what is freedom,Freedom is the power or right to act, speak, or think as one wants without hindrance or restraint.
what is liberty,Liberty is the state of being free within society from oppressive restrictions imposed by authority on one's way of life, behavior, or political views.
what is equality,Equality is the state of being equal, especially in status, rights, and opportunities.
what is fraternity,Fraternity is a group of people sharing a common profession or interests.
what is democracy,Democracy is a system of government where the citizens exercise power by voting.
what is rights,A right is a legal or moral entitlement to have or obtain something or to act in a certain way.
what is duty,A duty is a commitment or expectation to perform some action in general or if certain circumstances arise.
what is responsibility,Responsibility is the state or fact of having a duty to deal with something or of having control over someone.
what is honor,Honor is a quality of a person that is of both social teaching and personal ethos, that manifests itself as a code of conduct.
what is respect,Respect is a positive feeling or action shown towards someone or something considered important.
what is love,Love encompasses a range of strong and positive emotional and mental states.
what is hate,Hate is an intense negative emotional response towards certain people, things or ideas.
what is anger,Anger is an intense emotional state involving a strong uncomfortable and non-cooperative response to a perceived provocation, hurt or threat.
what is fear,Fear is an emotion induced by perceived danger or threat.
what is joy,Joy is the emotion of great delight or happiness caused by something exceptionally good or satisfying.
what is sadness,Sadness is an emotional pain associated with, or characterized by, feelings of disadvantage, loss, despair, grief, helplessness, disappointment and sorrow.
what is surprise,Surprise is a brief mental and physiological state, a startle response experienced by animals and humans as the result of an unexpected event.
what is disgust,Disgust is an emotional response of rejection or revulsion to something potentially contagious or something considered offensive, distasteful, or unpleasant.
what is hope,Hope is an optimistic state of mind that is based on an expectation of positive outcomes with respect to events and circumstances in one's life or the world at large.
what is despair,Despair is the loss of hope.
what is courage,Courage is the choice and willingness to confront agony, pain, danger, uncertainty, or intimidation.
what is cowardice,Cowardice is a trait wherein fear and excess self-concern override doing or saying what is right, good and of help to others or oneself in a time of need.
what is patience,Patience is the ability to endure difficult circumstances.
what is impatience,Impatience is a lack of patience.
what is kindness,Kindness is a behavior marked by ethical characteristics, a pleasant disposition, and concern and consideration for others.
what is cruelty,Cruelty is pleasure in inflicting suffering or inaction towards another's suffering.
what is generosity,Generosity is the virtue of being liberal in giving.
what is greed,Greed is an uncontrolled longing for increase in the acquisition or consumption of material gain.
what is humility,Humility is the quality of being humble.
what is pride,Pride is a feeling of satisfaction derived from one's own achievements.
what is arrogance,Arrogance is an overbearing pride evidenced by a superior manner toward inferiors.
what is modesty,Modesty is a mode of dress and deportment intended to avoid encouraging sexual attraction in others.
what is shame,Shame is an unpleasant self-conscious emotion typically associated with a negative evaluation of the self.
what is guilt,Guilt is a cognitive or an emotional experience that occurs when a person believes or realizes they have compromised their own standards of conduct.
what is regret,Regret is a negative conscious and emotional reaction to personal past acts and behaviors.
what is forgiveness,Forgiveness is the intentional and voluntary process by which a victim undergoes a change in feelings and attitude regarding an offense.
what is revenge,Revenge is committing a harmful action against a person or group in response to a grievance.
what is peace,Peace is a concept of societal friendship and harmony in the absence of hostility and violence.
what is war,War is intense armed conflict between states, governments, societies, or paramilitary groups.
what is conflict,Conflict is a serious disagreement or argument.
what is violence,Violence is the use of physical force so as to injure, abuse, damage, or destroy.
what is power,Power is the capacity to influence the behavior of others or the course of events.
what is authority,Authority is the legitimate power which one person or group possesses and practices over another.
what is influence,Influence is the capacity to have an effect on the character, development, or behavior of someone or something.
what is control,Control is the power to influence or direct people's behavior or the course of events.
what is domination,Domination is the exercise of control or influence over someone or something.
what is submission,Submission is the action of accepting or yielding to a superior force or to the will or authority of another person.
what is independence,Independence is a condition of a person, nation, country, or state in which its residents and population, or some portion thereof, exercise self-government, and usually sovereignty, over its territory.
what is dependence,Dependence is the state of relying on or being controlled by someone or something else.
what is interdependence,Interdependence is the mutual reliance between two or more groups.
what is cooperation,Cooperation is the process of groups of organisms working or acting together for common, mutual, or some underlying benefit.
what is competition,Competition is a rivalry where two or more parties strive for a common goal which cannot be shared.
what is winning,Winning is the act of being successful in a competition or contest.
what is losing,Losing is failing to win a competition or contest.
what is success,Success is the accomplishment of an aim or purpose.
what is failure,Failure is the state or condition of not meeting a desirable or intended objective.
what is achievement,Achievement is a thing done successfully, typically by effort, courage, or skill.
what is goal,A goal is an idea of the future or desired result that a person or a group of people envision, plan and commit to achieve.
what is dream,A dream is a succession of images, ideas, emotions, and sensations that usually occur involuntarily in the mind during certain stages of sleep.
what is ambition,Ambition is a strong desire to do or to achieve something, typically requiring determination and hard work.
what as a car,A car is a wheeled motor vehicle used for transportation.
what is a bus,A bus is a road vehicle designed to carry many passengers.
what is a train,A train is a form of rail transport consisting of a series of connected vehicles that generally run along a railroad track to transport cargo or passengers.
what is a plane,A plane is a powered, fixed-wing aircraft that is propelled forward by thrust from a jet engine, propeller or rocket engine.
what is a boat,A boat is a watercraft of a large range of types and sizes.
what is a ship,A ship is a large watercraft that travels the world's oceans and other sufficiently deep waterways.
what is a bicycle,A bicycle is a human-powered or motor-powered, pedal-driven, single-track vehicle, having two wheels attached to a frame, one behind the other.
what is a motorcycle,A motorcycle is a two- or three-wheeled motor vehicle.
what is a truck,A truck is a motor vehicle designed to transport cargo.
what is a road,A road is a wide way leading from one place to another, especially one with a specially prepared surface which vehicles can use.
what is a highway,A highway is a main road, especially one connecting major towns or cities.
what is a bridge,A bridge is a structure built to span a physical obstacle without closing the way underneath.
what is a tunnel,A tunnel is an underground or underwater passage.
what is a building,A building is a structure with a roof and walls standing more or less permanently in one place.
what is a house,A house is a building that functions as a home.
what is a apartment,An apartment is a self-contained housing unit that occupies part of a building.
what is a office,An office is a room, set of rooms, or building where people work.
what is a school,A school is an institution designed to provide learning spaces and learning environments for the teaching of students under the direction of teachers.
what is a university,A university is an institution of higher education and research which awards academic degrees in various academic disciplines.
what is a college,A college is an educational institution or a constituent part of one.
what is a teacher,A teacher is a person who helps students to acquire knowledge, competence or virtue.
what is a student,A student is a person enrolled in a school or other educational institution.
what is a professor,A professor is a senior teacher, lecturer and researcher, usually in a college or university.
what is a class,A class is a course of instruction.
what is a lesson,A lesson is a structured period of time where learning is intended to occur.
what is a test,A test is an assessment intended to measure the test-taker's knowledge, skill, aptitude, physical fitness, or classification in many other topics.
what is a exam,An exam is a formal test of a person's knowledge or proficiency in a particular subject or skill.
what is a grade,A grade is a standardized measurement of academic achievement.
what is a degree,A degree is any of a wide range of status levels conferred by institutions of higher education.
what is a diploma,A diploma is a certificate or deed issued by an educational institution.
what is a certificate,A certificate is a document that confirms certain facts.
what is a license,A license is an official permission or permit to do, use, or own something.
what is a permit,A permit is an official document giving someone authorization to do something.
what is a passport,A passport is a travel document, usually issued by a country's government, that certifies the identity and nationality of its holder.
what is a visa,A visa is a conditional authorization granted by a territory to a foreigner, allowing them to enter, remain within, or to leave that territory.
what is a citizen,A citizen is a person recognized under the custom or law of a sovereign state as a legal member of that state.
what is a country,A country is a distinct territorial body or political entity.
what is a nation,A nation is a stable community of people, formed on the basis of a common language, territory, economic life, ethnicity or psychological make-up manifested in a common culture.
what is a state,A state is a political organization with a centralized government that maintains a monopoly on the legitimate use of force within a certain geographical territory.
what is a government,Government is the system or group of people governing an organized community, generally a state.
what is politics,Politics is the set of activities that are associated with making decisions in groups, or other forms of power relations between individuals.
what is a election,An election is a formal group decision-making process by which a population chooses an individual or multiple individuals to hold public office.
what is a vote,A vote is a formal expression of an individual's choice for or against a candidate, a political party, or a policy proposal.
what is a campaign,A campaign is any series of actions or events that are meant to achieve a particular result.
what is a party,A political party is an organization that coordinates candidates to compete in a particular country's elections.
what is a leader,A leader is a person who leads or commands a group, organization, or country.
what is a follower,A follower is a person who supports and admires a particular person or set of ideas.
what is a hero,A hero is a person who is admired for their courage, outstanding achievements, or noble qualities.
what is a villain,A villain is a character whose evil actions or motives are important to the plot.
what is a role model,A role model is a person looked to by others as an example to be imitated.
what is a idol,An idol is an image or representation of a god used as an object of worship.
what is a celebrity,A celebrity is a famous person.
what is fame,Fame is the state of being known or talked about by many people.
what is fortune,Fortune is chance or luck as an external, arbitrary force affecting human affairs.
what is wealth,Wealth is the abundance of valuable financial assets or physical possessions which can be converted into a form that can be used for transactions.
what is poverty,Poverty is the state of having little or no money, goods, or means of support.
what is charity,Charity is the voluntary giving of help, typically in the form of money, to those in need.
what is donation,A donation is a gift for charity, humanitarian aid, or to benefit a cause.
what is volunteer,Volunteering is generally considered an altruistic activity where an individual or group provides services for no financial gain.
what is community,A community is a social unit with commonality such as norms, religion, values, customs, or identity.
what is society,Society is a group of individuals involved in persistent social interaction.
what is culture,Culture is the social behavior and norms found in human societies.
