question,answer
what is tradition,A tradition is a belief or behavior passed down within a group or society with symbolic meaning or special significance with origins in the past.
what is custom,A custom is a traditional and widely accepted way of behaving or doing something that is specific to a particular society, place, or time.
what is habit,A habit is a routine of behavior that is repeated regularly and tends to occur subconsciously.
what is routine,A routine is a sequence of actions regularly followed.
what is schedule,A schedule is a plan for carrying out a process or procedure, giving lists of intended events and times.
what is time management,Time management is the process of planning and exercising conscious control of time spent on specific activities.
what is organization,An organization is an entity comprising multiple people, such as an institution or an association, that has a particular purpose.
what is system,A system is a group of interacting or interrelated elements that act according to a set of rules to form a unified whole.
what is structure,A structure is an arrangement and organization of interrelated elements in a material object or system.
what is function,A function is the purpose for which something is designed or exists.
what is process,A process is a series of actions or steps taken in order to achieve a particular end.
what is method,A method is a particular procedure for accomplishing or approaching something.
what is technique,A technique is a way of carrying out a particular task.
what is strategy,Strategy is a high-level plan to achieve one or more goals under conditions of uncertainty.
what is plan,A plan is typically any diagram or list of steps with timing and resources, used to achieve an objective.
what is project,A project is an individual or collaborative enterprise that is carefully planned to achieve a particular aim.
what is task,A task is a piece of work to be done or undertaken.
what is job,A job is a paid position of regular employment.
what is work,Work is activity involving mental or physical effort done in order to achieve a purpose or result.
what is career,A career is an individual's journey through learning, work and other aspects of life.
what is profession,A profession is a paid occupation, especially one that involves prolonged training and a formal qualification.
what is business,Business is the practice of making one's living by engaging in commerce.
what is company,A company is a legal entity formed by a group of individuals to engage in and operate a business.
what is corporation,A corporation is a company or group of people authorized to act as a single entity and recognized as such in law.
what is industry,Industry is the production of goods or related services within an economy.
what is commerce,Commerce is the conduct of trade among economic agents.
what is trade,Trade is the basic economic concept involving buying and selling of goods and services.
what is market,A market is a place where parties can gather to facilitate the exchange of goods and services.
what is economy,An economy is an area of the production, distribution and trade, as well as consumption of goods and services by different agents.
what is money,Money is any item or verifiable record that is generally accepted as payment for goods and services.
what is currency,Currency is a system of money in general use in a particular country.
what is bank,A bank is a financial institution that accepts deposits from the public and creates credit.
what is account,An account is a record of financial transactions for an asset or individual.
what is transaction,A transaction is an agreement between a buyer and a seller to exchange goods, services, or financial instruments.
what is payment,Payment is the transfer of money or goods and services in exchange for a product or service.
what is invoice,An invoice is a time-stamped commercial document that itemizes and records a transaction between a buyer and a seller.
what is receipt,A receipt is a document acknowledging that a person has received money or property in payment following a sale or other transfer of goods or provision of a service.
what is budget,A budget is a financial plan for a defined period.
what is expense,An expense is the cost of operations that a company incurs to generate revenue.
what is income,Income is the consumption and saving opportunity gained by an entity within a specified timeframe.
what is profit,Profit is the financial benefit realized when revenue generated from a business activity exceeds the expenses, costs, and taxes involved.
what is loss,Loss is the amount a company's expenses exceed its revenues.
what is tax,A tax is a compulsory financial charge or some other type of levy imposed upon a taxpayer by a governmental organization.
what is debt,Debt is an amount of money borrowed by one party from another.
what is credit,Credit is the trust which allows one party to provide money or resources to another party.
what is loan,A loan is the lending of money by one or more individuals, organizations, or other entities to other individuals, organizations.
what is interest,Interest is the charge for the privilege of borrowing money.
what is investment,Investment is the dedication of money to purchase of an asset to attain an increase in value over a period of time.
what is stock,A stock is a type of security that signifies ownership in a corporation.
what is bond,A bond is a fixed income instrument that represents a loan made by an investor to a borrower.
what is share,A share is a unit of ownership in a corporation or financial asset.
what is dividend,A dividend is the distribution of some of a company's earnings to a class of its shareholders.
what is portfolio,A portfolio is a collection of financial investments like stocks, bonds, commodities, cash, and cash equivalents.
what is risk,Risk is the possibility of something bad happening.
what is return,Return is the gain or loss of an investment over a specified period.
what is asset,An asset is a resource with economic value that an individual, corporation, or country owns or controls.
what is liability,A liability is something a person or company owes, usually a sum of money.
what is equity,Equity is the value of an asset after liabilities have been deducted.
what is balance sheet,A balance sheet is a financial statement that reports a company's assets, liabilities and shareholders' equity.
what is income statement,An income statement is one of the financial statements of a company and shows the company's revenues and expenses.
what is cash flow,Cash flow is the net amount of cash and cash-equivalents being transferred into and out of a business.
what is financial statement,A financial statement is a formal record of the financial activities and position of a business, person, or other entity.
what is audit,An audit is an independent examination of financial information of any entity.
what is accountant,An accountant is a practitioner of accounting or accountancy.
what is finance,Finance is the study and discipline of money, currency and capital assets.
what is economics,Economics is the social science that studies how people interact with value; in particular, the production, distribution, and consumption of goods and services.
what is supply,Supply is a fundamental economic concept that describes the total amount of a specific good or service that is available to consumers.
what is demand,Demand is an economic principle referring to a consumer's desire to purchase goods and services.
what is price,Price is the quantity of payment or compensation given by one party to another in return for one unit of goods or services.
what is value,Value is the monetary, material, or assessed worth of an asset, good, or service.
what is cost,Cost is the value of money that has been used up to produce something.
what is worth,Worth is the value of something measured by its qualities or by the esteem in which it is held.
what is quality,Quality is the standard of something as measured against other things of a similar kind.
what is quantity,Quantity is the amount or number of a material or abstract thing.
what is measure,Measure is the quantification of attributes of an object or event.
what is unit,A unit of measurement is a definite magnitude of a quantity, defined and adopted by convention.
what is scale,Scale is the ratio of the distance on a map to the corresponding distance on the ground.
what is size,Size is the magnitude or dimensions of a thing.
what is weight,Weight is the force exerted on a body by gravity.
what is height,Height is the measure of vertical distance.
what is length,Length is a measure of distance.
what is width,Width is the measurement or extent of something from side to side.
what is depth,Depth is the distance from the top or surface to the bottom of something.
what is volume,Volume is the quantity of three-dimensional space enclosed by a closed surface.
what is area,Area is the quantity that expresses the extent of a two-dimensional figure or shape.
what is speed,Speed is the rate at which someone or something is able to move or operate.
what is velocity,Velocity is the speed of something in a given direction.
what is acceleration,Acceleration is the rate of change of velocity per unit of time.
what is momentum,Momentum is the quantity of motion of a moving body.
what is force,In physics, a force is any interaction that, when unopposed, will change the motion of an object.
what is energy,Energy is the quantitative property that must be transferred to an object to perform work on, or to heat, the object.
what is power,Power is the amount of energy transferred or converted per unit time.
what is work,In physics, work is the energy transferred to or from an object via the application of force along a displacement.
what is pressure,Pressure is the force applied perpendicular to the surface of an object per unit area.
what is temperature,Temperature is a physical quantity that expresses hot and cold.
what is heat,Heat is the transfer of kinetic energy from one medium or object to another.
what is cold,Cold is the presence of low temperature.
what is weather,Weather is the state of the atmosphere, describing for example the degree to which it is hot or cold, wet or dry, calm or stormy, clear or cloudy.
what is climate,Climate is the long-term pattern of weather in a particular area.
what is season,A season is a division of the year marked by changes in weather, ecology, and amount of daylight.
what is spring,Spring is one of the four temperate seasons, succeeding winter and preceding summer.
what is summer,Summer is the hottest of the four temperate seasons, falling between spring and autumn.
what is autumn,Autumn is one of the four temperate seasons, marking the transition from summer to winter.
what is winter,Winter is the coldest season of the year in polar and temperate zones.
what is day,A day is approximately the period during which the Earth completes one rotation around its axis.
what is night,Night is the period of ambient darkness from sunset to sunrise.
what is week,A week is a time unit equal to seven days.
what is month,A month is a unit of time, used with calendars, that is approximately as long as a natural orbital period of the Moon.
what is year,A year is the orbital period of Earth moving in its orbit around the Sun.
what is decade,A decade is a period of 10 years.
what is century,A century is a period of 100 years.
what is millennium,A millennium is a period of 1000 years.
what is time,Time is the continued sequence of existence and events.
what is past,The past is the set of all events that occurred before a given point in time.
what is present,The present is the time associated with the events perceived directly and in the first time.
what is future,The future is the time after the present.
what is history,History is the study of the past.
what is prehistory,Prehistory is the period of time before written records.
what is ancient,Ancient history is the aggregate of past events from the beginning of writing and recorded human history.
what is medieval,The Middle Ages is the period of European history from the fall of the Roman Empire to the fall of Constantinople.
what is modern,Modern history is the history of the world beginning after the Middle Ages.
what is contemporary,Contemporary history is the history of the recent past.
what is age,An age is a distinct period of history.
what is era,An era is a span of time defined for the purposes of chronology or historiography.
what is period,A period is a major interval of time.
what is epoch,An epoch is a particular period of time in history or a person's life.
what is generation,A generation is all of the people born and living at about the same time.
what is life,Life is a characteristic that distinguishes physical entities that have biological processes.
what is death,Death is the permanent cessation of all biological functions that sustain a living organism.
what is birth,Birth is the act or process of bearing or bringing forth offspring.
what is growth,Growth refers to a positive change in size, often over a period of time.
what is development,Development is the process of developing or being developed.
what is change,Change is the act or instance of making or becoming different.
what is progress,Progress is movement towards a refined, improved, or otherwise desired state.
what as a car,A car is a wheeled motor vehicle used for transportation.
what is a bus,A bus is a road vehicle designed to carry many passengers.
what is a train,A train is a form of rail transport consisting of a series of connected vehicles that generally run along a railroad track to transport cargo or passengers.
what is a plane,A plane is a powered, fixed-wing aircraft that is propelled forward by thrust from a jet engine, propeller or rocket engine.
what is a boat,A boat is a watercraft of a large range of types and sizes.
what is a ship,A ship is a large watercraft that travels the world's oceans and other sufficiently deep waterways.
what is a bicycle,A bicycle is a human-powered or motor-powered, pedal-driven, single-track vehicle, having two wheels attached to a frame, one behind the other.
what is a motorcycle,A motorcycle is a two- or three-wheeled motor vehicle.
what is a truck,A truck is a motor vehicle designed to transport cargo.
what is a road,A road is a wide way leading from one place to another, especially one with a specially prepared surface which vehicles can use.
what is a highway,A highway is a main road, especially one connecting major towns or cities.
what is a bridge,A bridge is a structure built to span a physical obstacle without closing the way underneath.
what is a tunnel,A tunnel is an underground or underwater passage.
what is a building,A building is a structure with a roof and walls standing more or less permanently in one place.
what is a house,A house is a building that functions as a home.
what is a apartment,An apartment is a self-contained housing unit that occupies part of a building.
what is a office,An office is a room, set of rooms, or building where people work.
what is a school,A school is an institution designed to provide learning spaces and learning environments for the teaching of students under the direction of teachers.
what is a university,A university is an institution of higher education and research which awards academic degrees in various academic disciplines.
what is a college,A college is an educational institution or a constituent part of one.
what is a teacher,A teacher is a person who helps students to acquire knowledge, competence or virtue.
what is a student,A student is a person enrolled in a school or other educational institution.
what is a professor,A professor is a senior teacher, lecturer and researcher, usually in a college or university.
what is a class,A class is a course of instruction.
what is a lesson,A lesson is a structured period of time where learning is intended to occur.
what is a test,A test is an assessment intended to measure the test-taker's knowledge, skill, aptitude, physical fitness, or classification in many other topics.
what is a exam,An exam is a formal test of a person's knowledge or proficiency in a particular subject or skill.
what is a grade,A grade is a standardized measurement of academic achievement.
what is a degree,A degree is any of a wide range of status levels conferred by institutions of higher education.
what is a diploma,A diploma is a certificate or deed issued by an educational institution.
what is a certificate,A certificate is a document that confirms certain facts.
what is a license,A license is an official permission or permit to do, use, or own something.
what is a permit,A permit is an official document giving someone authorization to do something.
what is a passport,A passport is a travel document, usually issued by a country's government, that certifies the identity and nationality of its holder.
what is a visa,A visa is a conditional authorization granted by a territory to a foreigner, allowing them to enter, remain within, or to leave that territory.
what is a citizen,A citizen is a person recognized under the custom or law of a sovereign state as a legal member of that state.
what is a country,A country is a distinct territorial body or political entity.
what is a nation,A nation is a stable community of people, formed on the basis of a common language, territory, economic life, ethnicity or psychological make-up manifested in a common culture.
what is a state,A state is a political organization with a centralized government that maintains a monopoly on the legitimate use of force within a certain geographical territory.
what is a government,Government is the system or group of people governing an organized community, generally a state.
what is politics,Politics is the set of activities that are associated with making decisions in groups, or other forms of power relations between individuals.
what is a election,An election is a formal group decision-making process by which a population chooses an individual or multiple individuals to hold public office.
what is a vote,A vote is a formal expression of an individual's choice for or against a candidate, a political party, or a policy proposal.
what is a campaign,A campaign is any series of actions or events that are meant to achieve a particular result.
what is a party,A political party is an organization that coordinates candidates to compete in a particular country's elections.
what is a leader,A leader is a person who leads or commands a group, organization, or country.
what is a follower,A follower is a person who supports and admires a particular person or set of ideas.
what is a hero,A hero is a person who is admired for their courage, outstanding achievements, or noble qualities.
what is a villain,A villain is a character whose evil actions or motives are important to the plot.
what is a role model,A role model is a person looked to by others as an example to be imitated.
what is a idol,An idol is an image or representation of a god used as an object of worship.
what is a celebrity,A celebrity is a famous person.
what is fame,Fame is the state of being known or talked about by many people.
what is fortune,Fortune is chance or luck as an external, arbitrary force affecting human affairs.
what is wealth,Wealth is the abundance of valuable financial assets or physical possessions which can be converted into a form that can be used for transactions.
what is poverty,Poverty is the state of having little or no money, goods, or means of support.
what is charity,Charity is the voluntary giving of help, typically in the form of money, to those in need.
what is donation,A donation is a gift for charity, humanitarian aid, or to benefit a cause.
what is volunteer,Volunteering is generally considered an altruistic activity where an individual or group provides services for no financial gain.
what is community,A community is a social unit with commonality such as norms, religion, values, customs, or identity.
what is society,Society is a group of individuals involved in persistent social interaction.
what is culture,Culture is the social behavior and norms found in human societies.
what is tradition,A tradition is a belief or behavior passed down within a group or society with symbolic meaning or special significance with origins in the past.
what is custom,A custom is a traditional and widely accepted way of behaving or doing something that is specific to a particular society, place, or time.
what is habit,A habit is a routine of behavior that is repeated regularly and tends to occur subconsciously.
what is routine,A routine is a sequence of actions regularly followed.
what is schedule,A schedule is a plan for carrying out a process or procedure, giving lists of intended events and times.
what is time management,Time management is the process of planning and exercising conscious control of time spent on specific activities.
what is organization,An organization is an entity comprising multiple people, such as an institution or an association, that has a particular purpose.
what is system,A system is a group of interacting or interrelated elements that act according to a set of rules to form a unified whole.
what is structure,A structure is an arrangement and organization of interrelated elements in a material object or system.
what is function,A function is the purpose for which something is designed or exists.
what is process,A process is a series of actions or steps taken in order to achieve a particular end.
what is method,A method is a particular procedure for accomplishing or approaching something.
what is technique,A technique is a way of carrying out a particular task.
what is strategy,Strategy is a high-level plan to achieve one or more goals under conditions of uncertainty.
what is plan,A plan is typically any diagram or list of steps with timing and resources, used to achieve an objective.
what is project,A project is an individual or collaborative enterprise that is carefully planned to achieve a particular aim.
what is task,A task is a piece of work to be done or undertaken.
what is job,A job is a paid position of regular employment.
what is work,Work is activity involving mental or physical effort done in order to achieve a purpose or result.
what is career,A career is an individual's journey through learning, work and other aspects of life.
what is profession,A profession is a paid occupation, especially one that involves prolonged training and a formal qualification.
what is business,Business is the practice of making one's living by engaging in commerce.
what is company,A company is a legal entity formed by a group of individuals to engage in and operate a business.
what is corporation,A corporation is a company or group of people authorized to act as a single entity and recognized as such in law.
what is industry,Industry is the production of goods or related services within an economy.
what is commerce,Commerce is the conduct of trade among economic agents.
what is trade,Trade is the basic economic concept involving buying and selling of goods and services.
what is market,A market is a place where parties can gather to facilitate the exchange of goods and services.
what is economy,An economy is an area of the production, distribution and trade, as well as consumption of goods and services by different agents.
what is money,Money is any item or verifiable record that is generally accepted as payment for goods and services.
what is currency,Currency is a system of money in general use in a particular country.
what is bank,A bank is a financial institution that accepts deposits from the public and creates credit.
what is account,An account is a record of financial transactions for an asset or individual.
what is transaction,A transaction is an agreement between a buyer and a seller to exchange goods, services, or financial instruments.
what is payment,Payment is the transfer of money or goods and services in exchange for a product or service.
what is invoice,An invoice is a time-stamped commercial document that itemizes and records a transaction between a buyer and a seller.
what is receipt,A receipt is a document acknowledging that a person has received money or property in payment following a sale or other transfer of goods or provision of a service.
what is budget,A budget is a financial plan for a defined period.
what is expense,An expense is the cost of operations that a company incurs to generate revenue.
what is income,Income is the consumption and saving opportunity gained by an entity within a specified timeframe.
what is profit,Profit is the financial benefit realized when revenue generated from a business activity exceeds the expenses, costs, and taxes involved.
what is loss,Loss is the amount a company's expenses exceed its revenues.
what is tax,A tax is a compulsory financial charge or some other type of levy imposed upon a taxpayer by a governmental organization.
what is debt,Debt is an amount of money borrowed by one party from another.
what is credit,Credit is the trust which allows one party to provide money or resources to another party.
what is loan,A loan is the lending of money by one or more individuals, organizations, or other entities to other individuals, organizations.
what is interest,Interest is the charge for the privilege of borrowing money.
what is investment,Investment is the dedication of money to purchase of an asset to attain an increase in value over a period of time.
what is stock,A stock is a type of security that signifies ownership in a corporation.
what is bond,A bond is a fixed income instrument that represents a loan made by an investor to a borrower.
what is share,A share is a unit of ownership in a corporation or financial asset.
